{"captured_at_ms":0,"device_id":"node-aaaaaaaaaaaaaaaaaaaaaaaaaaaaaaa","measurements":{"heart_rate_bpm":70,"spo2_percent":99,"temperature_c":36.6},"packet_type":"telemetry","patient_id":"patient-bbbbbbbbbbbbbbbbbbbbbbbbbbbbbbb","priority":"routine","schema_version":1,"sequence_number":9,"signal_quality":0.9}